{
  "$schema": "https://json-schema.org/draft/2020-12/schema",
  "type": "object",
  "properties": {
    "title": {
      "type": "string"
    },
    "author": {
      "type": "string"
    },
    "issue": {
      "type": "string"
    },
    "published": {
      "type": "string",
      "format": "date-time"
    },
    "summary": {
      "type": "string"
    },
    "pdf": {
      "type": "string"
    },
    "tags": {
      "default": [],
      "type": "array",
      "items": {
        "type": "string"
      }
    },
    "$schema": {
      "type": "string"
    }
  },
  "required": [
    "title",
    "author",
    "issue",
    "published",
    "summary",
    "pdf"
  ]
}