{
  "title": "Editorial: More Loving Than God? (3)",
  "author": "Samuel Watterson",
  "issue": "British Reformed Journal, Volume 77",
  "published": "2025-11-10",
  "summary": "The third in a series of editorials responding to the Open Theist challenge that God is less loving than those who wish all to be saved. The author turns from critique to construction, asking how Scripture itself measures God's love, and how that biblical measure shapes our calling to love both the elect and the ungodly.",
  "pdf": "/articles/more-loving-than-god.pdf",
  "tags": ["Editorial", "Theology", "Open Theism", "Love of God"]
}
