{
  "title": "God's Saving Will in the New Testament (1)",
  "author": "Rev. Angus Stewart",
  "issue": "British Reformed Journal, Volume 77",
  "published": "2025-11-10",
  "summary": "A study of the two Greek verbs for willing — thelō and boulomai — and how they appear throughout the New Testament to describe God's saving will. The author distinguishes God's will of decree (what He sovereignly decides) from His will of precept (what He commands), and traces the implications for assurance, prayer, and Christian living.",
  "pdf": "/articles/gods-saving-will-in-the-new-testament.pdf",
  "tags": ["Theology", "Biblical Studies", "Greek", "Sovereignty"]
}
